{
  "schema_version": 1,
  "issue_number": 4,
  "leaf_id": "L02",
  "role": "research-worker",
  "owned_paths": [
    "research/issues/canonical-differential-saturation/"
  ],
  "base_sha": "652a5e252626fa5816445651245e8a8946cee53e",
  "candidate_sha": "d8c9dc19ad6201042afb315ccab57489c863105b",
  "scientific_status": "scoped equivalence, divisorial pole-stage theorem, counterexamples, corrected multiplier and intersection audit, and exact reduction / MUTABLE_NONAUTHORITATIVE",
  "review_mode": "local-adversarial-review",
  "reviewed_revision": "d8c9dc19ad6201042afb315ccab57489c863105b",
  "proposed_global_claims": [
    {
      "id": "CDS-003",
      "status": "candidate_proved",
      "statement": "The normalization-seed differential saturation is finite if and only if the finite normalization is unramified in codimension one."
    },
    {
      "id": "CDS-004",
      "status": "candidate_proved",
      "statement": "Because the normalization is finite over the target, every divisorial source boundary maps onto a height-one base divisor; ramified pole stages and genuine positive unramified pole stages have nonfinite saturation."
    },
    {
      "id": "CDS-005",
      "status": "candidate_proved",
      "statement": "At a generic height-one point of the full finite-cover permutation connection, an embedded ordinary coherent lattice exists if and only if local inertia is trivial."
    },
    {
      "id": "CDS-006",
      "status": "counterexample",
      "statement": "Regular holonomicity and coherent logarithmic extension do not imply ordinary structure-sheaf finiteness or translation stability."
    },
    {
      "id": "CDS-007",
      "status": "open_bridge",
      "statement": "Derive trivial height-one inertia from the polynomial Keller source; a direct global D-module route additionally requires global ordinary coherence with a compatible connection preserving both unscaled translations, and a torsion-free meromorphic embedding with generic fiber L."
    },
    {
      "id": "CDS-008",
      "status": "negative_audit",
      "statement": "The audited dual, canonical, intersection, jet, and cohomological constructions do not bypass the inertia bridge; the finite-seed obstruction applies only to full intersections, and multiplier stability is a separate stable-order condition."
    }
  ],
  "proposed_graph_nodes": [
    {
      "id": "ISSUE4-CDS-COHERENCE-WALL",
      "status": "open",
      "dependencies": [
        "CLM-003",
        "CLM-010",
        "CLM-011",
        "CLM-013",
        "CLM-061"
      ],
      "statement": "The normalization-saturation and local D-module routes reduce to trivial height-one inertia; logarithmic or holonomic coherence is insufficient, and the direct global D-module route also needs an embedded ordinary coherent extension with a compatible connection preserving both unscaled translations."
    }
  ],
  "shared_surfaces_requested": [
    "research/claim_ledger.json",
    "research/proof_graph.json",
    "research/work_queue.json",
    "research/ISSUE_INDEX.md",
    "research/leaf-packets/L02-stable-order.md",
    "research/tracks/d-stable-differential-lattice.md"
  ],
  "supersedes_prs": [],
  "temporary_artifacts_absent": true,
  "integration_state": "integration-ready",
  "pr_number": 42,
  "completion_receipt": null
}
